Const,Your Rating,Date Rated,Title,URL,Title Type,IMDb Rating,Runtime (mins),Year,Genres,Num Votes,Release Date,Directors
tt0437857,8,2023-10-19,Behind the Mask: The Rise of Leslie Vernon,https://www.imdb.com/title/tt0437857/,movie,6.7,92,2006,"Comedy, Horror, Thriller",25284,2006-07-08,Scott Glosserman
tt0438097,8,2022-01-29,Ice Age: The Meltdown,https://www.imdb.com/title/tt0438097/,movie,6.8,91,2006,"Animation, Adventure, Comedy, Family",294062,2006-03-29,Carlos Saldanha
tt0439572,8,2023-07-23,The Flash,https://www.imdb.com/title/tt0439572/,movie,6.7,144,2023,"Action, Adventure, Fantasy, Sci-Fi",201045,2023-06-14,Andy Muschietti
tt0441773,10,2021-07-06,Kung Fu Panda,https://www.imdb.com/title/tt0441773/,movie,7.6,92,2008,"Animation, Action, Adventure, Comedy, Family, Fantasy",510804,2008-05-15,"John Stevenson, Mark Osborne"
tt4425200,8,2022-09-30,John Wick: Chapter 2,https://www.imdb.com/title/tt4425200/,movie,7.4,122,2017,"Action, Crime, Thriller",504976,2017-01-30,Chad Stahelski
tt0443453,10,2022-05-21,Borat: Cultural Learnings of America for Make Benefit Glorious Nation of Kazakhstan,https://www.imdb.com/title/tt0443453/,movie,7.4,84,2006,Comedy,437501,2006-08-04,Larry Charles
tt0446029,10,2023-04-01,Scott Pilgrim vs. the World,https://www.imdb.com/title/tt0446029/,movie,7.6,112,2010,"Action, Comedy, Fantasy, Romance",461346,2010-07-27,Edgar Wright
tt4463894,7,2022-02-04,Shaft,https://www.imdb.com/title/tt4463894/,movie,6.4,111,2019,"Action, Comedy, Crime, Mystery",58192,2019-06-14,Tim Story
tt4468740,8,2023-03-23,Paddington 2,https://www.imdb.com/title/tt4468740/,movie,7.8,103,2017,"Adventure, Comedy, Family, Fantasy",92220,2017-11-05,Paul King
tt0448115,10,2019-04-29,Shazam!,https://www.imdb.com/title/tt0448115/,movie,7.0,132,2019,"Action, Adventure, Comedy, Fantasy",380736,2019-03-25,David F. Sandberg
tt0448157,8,2021-10-31,Hancock,https://www.imdb.com/title/tt0448157/,movie,6.4,92,2008,"Action, Comedy, Drama, Fantasy",507776,2008-06-16,Peter Berg
tt0448694,8,2022-11-25,Puss in Boots,https://www.imdb.com/title/tt0448694/,movie,6.6,90,2011,"Animation, Action, Adventure, Comedy, Family, Fantasy, Mystery, Romance",189990,2011-10-23,Chris Miller
tt0449059,10,2022-04-12,Little Miss Sunshine,https://www.imdb.com/title/tt0449059/,movie,7.8,101,2006,"Comedy, Drama",512783,2006-01-20,"Jonathan Dayton, Valerie Faris"
tt0449088,7,2023-07-11,Pirates of the Caribbean: At World's End,https://www.imdb.com/title/tt0449088/,movie,7.1,169,2007,"Action, Adventure, Fantasy",686491,2007-05-19,Gore Verbinski
tt4495098,9,2023-09-29,Gran Turismo,https://www.imdb.com/title/tt4495098/,movie,7.2,134,2023,"Action, Adventure, Drama, Sport",82758,2023-07-16,Neill Blomkamp
tt4500922,8,2022-03-27,Maze Runner: The Death Cure,https://www.imdb.com/title/tt4500922/,movie,6.2,143,2018,"Action, Adventure, Sci-Fi, Thriller",159270,2018-01-17,Wes Ball
tt4501244,8,2022-04-11,Why Him?,https://www.imdb.com/title/tt4501244/,movie,6.2,111,2016,Comedy,122536,2016-12-17,John Hamburg
tt4508902,10,2022-07-13,One Punch Man: Wanpanman,https://www.imdb.com/title/tt4508902/,tvSeries,8.7,24,2015,"Animation, Action, Comedy, Family, Fantasy, Sci-Fi",182736,2015-10-01,
tt0451079,7,2023-03-23,Horton Hears a Who!,https://www.imdb.com/title/tt0451079/,movie,6.8,86,2008,"Animation, Adventure, Comedy, Drama, Family, Fantasy, Music",149217,2008-03-03,"Steve Martino, Jimmy Hayward"
tt0451279,10,2021-02-16,Wonder Woman,https://www.imdb.com/title/tt0451279/,movie,7.3,141,2017,"Action, Adventure, Fantasy, Sci-Fi, War",694021,2017-05-15,Patty Jenkins
tt4513678,8,2021-11-19,Ghostbusters: Afterlife,https://www.imdb.com/title/tt4513678/,movie,7.1,124,2021,"Adventure, Comedy, Fantasy, Sci-Fi",208766,2021-10-08,Jason Reitman
tt4520988,9,2023-03-23,Frozen II,https://www.imdb.com/title/tt4520988/,movie,6.8,103,2019,"Animation, Adventure, Comedy, Drama, Family, Fantasy, Musical",191636,2019-11-07,"Jennifer Lee, Chris Buck"
tt4532368,9,2023-03-23,Legends of Tomorrow,https://www.imdb.com/title/tt4532368/,tvSeries,6.8,42,2016,"Action, Adventure, Drama, Sci-Fi",109531,2016-01-21,
tt0453467,9,2022-08-05,Deja Vu,https://www.imdb.com/title/tt0453467/,movie,7.1,126,2006,"Action, Crime, Sci-Fi, Thriller",325240,2006-11-20,Tony Scott
tt4547194,8,2022-04-12,I Kill Giants,https://www.imdb.com/title/tt4547194/,movie,6.1,106,2017,"Drama, Fantasy, Thriller",32833,2017-09-09,Anders Walter
tt0454848,8,2021-09-05,Inside Man,https://www.imdb.com/title/tt0454848/,movie,7.6,129,2006,"Crime, Drama, Mystery, Thriller",394040,2006-03-16,Spike Lee
tt0454987,6,2023-03-23,Let's Go to Prison,https://www.imdb.com/title/tt0454987/,movie,5.9,84,2006,"Comedy, Crime",26383,2006-11-17,Bob Odenkirk
tt0457400,7,2022-04-30,Land of the Lost,https://www.imdb.com/title/tt0457400/,movie,5.3,102,2009,"Action, Adventure, Comedy, Sci-Fi",74847,2009-06-05,Brad Silberling
tt4574334,10,2021-01-03,Stranger Things,https://www.imdb.com/title/tt4574334/,tvSeries,8.7,51,2016,"Drama, Fantasy, Horror, Mystery, Sci-Fi, Thriller",1313210,2016-07-11,
tt4575576,9,2021-12-25,Christopher Robin,https://www.imdb.com/title/tt4575576/,movie,7.2,104,2018,"Adventure, Comedy, Drama, Family, Fantasy, Musical",83782,2018-07-30,Marc Forster
tt0458339,8,2021-11-04,Captain America: The First Avenger,https://www.imdb.com/title/tt0458339/,movie,6.9,124,2011,"Action, Adventure, Sci-Fi",889200,2011-07-19,Joe Johnston
tt4589218,7,2023-10-28,Five Nights at Freddy's,https://www.imdb.com/title/tt4589218/,movie,5.5,109,2023,"Horror, Mystery, Thriller",85465,2023-10-25,Emma Tammi
tt0460091,10,2021-11-17,My Name Is Earl,https://www.imdb.com/title/tt0460091/,tvSeries,7.8,22,2005,Comedy,108742,2005-09-20,
tt0460740,8,2024-01-16,Cashback,https://www.imdb.com/title/tt0460740/,movie,7.1,102,2006,"Comedy, Drama, Romance",90364,2006-09-10,Sean Ellis
tt4624424,9,2021-12-25,Storks,https://www.imdb.com/title/tt4624424/,movie,6.8,87,2016,"Animation, Adventure, Comedy, Family, Fantasy",66766,2016-09-22,"Nicholas Stoller, Doug Sweetland"
tt4633694,10,2021-12-22,Spider-Man: Into the Spider-Verse,https://www.imdb.com/title/tt4633694/,movie,8.4,117,2018,"Animation, Action, Adventure, Comedy, Family, Fantasy, Sci-Fi",656532,2018-12-12,"Peter Ramsey, Rodney Rothman, Bob Persichetti"
tt0463985,9,2023-03-23,The Fast and the Furious: Tokyo Drift,https://www.imdb.com/title/tt0463985/,movie,6.0,104,2006,"Action, Crime, Thriller",296066,2006-06-04,Justin Lin
tt4649466,8,2021-08-11,Kingsman: The Golden Circle,https://www.imdb.com/title/tt4649466/,movie,6.7,141,2017,"Action, Adventure, Comedy, Crime, Thriller",358298,2017-09-20,Matthew Vaughn
tt4651448,9,2019-11-10,Green Eggs and Ham,https://www.imdb.com/title/tt4651448/,tvSeries,8.1,26,2019,"Animation, Adventure, Comedy, Drama, Family, Fantasy, Mystery, Romance",3105,2019-11-08,
tt0466342,6,2023-08-19,Date Movie,https://www.imdb.com/title/tt0466342/,movie,2.8,83,2006,"Comedy, Romance",61897,2006-02-17,"Jason Friedberg, Aaron Seltzer"
tt0467406,8,2023-05-21,Juno,https://www.imdb.com/title/tt0467406/,movie,7.5,96,2007,"Comedy, Drama",545464,2007-09-01,Jason Reitman
tt4680182,10,2020-08-06,Colossal,https://www.imdb.com/title/tt4680182/,movie,6.2,109,2016,"Comedy, Drama, Fantasy, Sci-Fi",68581,2016-09-09,Nacho Vigalondo
tt4682266,8,2021-11-01,The New Mutants,https://www.imdb.com/title/tt4682266/,movie,5.3,94,2020,"Action, Horror, Mystery, Sci-Fi",88027,2020-08-26,Josh Boone
tt0468569,9,2023-04-17,The Dark Knight,https://www.imdb.com/title/tt0468569/,movie,9.0,152,2008,"Action, Crime, Drama, Thriller",2834989,2008-07-14,Christopher Nolan
tt4698684,8,2023-10-24,Hunt for the Wilderpeople,https://www.imdb.com/title/tt4698684/,movie,7.8,101,2016,"Adventure, Comedy, Drama",140268,2016-01-22,Taika Waititi
tt4701182,8,2021-05-29,Bumblebee,https://www.imdb.com/title/tt4701182/,movie,6.7,114,2018,"Action, Adventure, Sci-Fi",185951,2018-12-03,Travis Knight
tt0470752,8,2022-02-05,Ex Machina,https://www.imdb.com/title/tt0470752/,movie,7.7,108,2014,"Drama, Sci-Fi, Thriller",579649,2014-12-16,Alex Garland
tt0472033,9,2022-11-20,9,https://www.imdb.com/title/tt0472033/,movie,7.0,79,2009,"Animation, Action, Adventure, Drama, Fantasy, Sci-Fi, Thriller",146497,2009-08-19,Shane Acker
tt0472181,7,2022-05-19,The Smurfs,https://www.imdb.com/title/tt0472181/,movie,5.4,103,2011,"Animation, Adventure, Comedy, Family, Fantasy",95863,2011-07-24,Raja Gosnell
tt4729430,9,2019-11-15,Klaus,https://www.imdb.com/title/tt4729430/,movie,8.2,96,2019,"Animation, Adventure, Comedy, Family, Fantasy",186125,2019-11-08,"Carlos Martínez López, Sergio Pablos"
tt4761916,7,2023-03-23,Unfriended: Dark Web,https://www.imdb.com/title/tt4761916/,movie,6.0,92,2018,"Horror, Mystery, Thriller",37774,2018-03-09,Stephen Susco
tt4769836,7,2021-09-27,The Do-Over,https://www.imdb.com/title/tt4769836/,movie,5.7,108,2016,"Action, Adventure, Comedy, Mystery",50771,2016-05-27,Steven Brill
tt0477051,7,2021-10-28,Norbit,https://www.imdb.com/title/tt0477051/,movie,4.2,103,2007,"Comedy, Romance",79085,2007-02-09,Brian Robbins
tt0477347,8,2023-02-14,Night at the Museum,https://www.imdb.com/title/tt0477347/,movie,6.5,108,2006,"Adventure, Comedy, Family, Fantasy",373324,2006-12-17,Shawn Levy
tt4777008,7,2023-03-23,Maleficent: Mistress of Evil,https://www.imdb.com/title/tt4777008/,movie,6.6,119,2019,"Adventure, Family, Fantasy, Romance",117200,2019-10-16,Joachim Rønning
tt4779682,7,2023-03-19,The Meg,https://www.imdb.com/title/tt4779682/,movie,5.7,113,2018,"Action, Horror, Sci-Fi, Thriller",205009,2018-08-08,Jon Turteltaub
tt0478311,9,2022-12-27,Knocked Up,https://www.imdb.com/title/tt0478311/,movie,6.9,129,2007,"Comedy, Romance",382328,2007-03-12,Judd Apatow
tt4786282,8,2023-10-31,Lights Out,https://www.imdb.com/title/tt4786282/,movie,6.3,81,2016,"Horror, Mystery",140873,2016-06-08,David F. Sandberg
tt0478970,9,2021-11-04,Ant-Man,https://www.imdb.com/title/tt0478970/,movie,7.2,117,2015,"Action, Comedy, Sci-Fi",715184,2015-06-29,Peyton Reed
tt0479952,7,2022-02-04,Madagascar: Escape 2 Africa,https://www.imdb.com/title/tt0479952/,movie,6.6,89,2008,"Animation, Adventure, Comedy, Family",244654,2008-10-30,"Tom McGrath, Eric Darnell"
tt0480255,8,2022-02-24,The Losers,https://www.imdb.com/title/tt0480255/,movie,6.2,97,2010,"Action, Adventure, Comedy, Crime, Mystery, Thriller",106481,2010-04-20,Sylvain White
tt0480669,9,2022-06-10,Los cronocrímenes,https://www.imdb.com/title/tt0480669/,movie,7.1,92,2007,"Horror, Mystery, Sci-Fi, Thriller",68190,2007-09-20,Nacho Vigalondo
tt0481499,10,2020-10-29,The Croods,https://www.imdb.com/title/tt0481499/,movie,7.2,98,2013,"Animation, Action, Adventure, Comedy, Family, Fantasy",229792,2013-02-15,"Kirk DeMicco, Chris Sanders"
tt0481536,9,2023-04-29,Harold & Kumar Escape from Guantanamo Bay,https://www.imdb.com/title/tt0481536/,movie,6.5,114,2008,"Adventure, Comedy",141419,2008-04-24,"Jon Hurwitz, Hayden Schlossberg"
tt4823776,6,2023-09-21,The SpongeBob Movie: Sponge on the Run,https://www.imdb.com/title/tt4823776/,movie,5.9,91,2020,"Animation, Adventure, Comedy, Family, Fantasy",21257,2020-07-30,Tim Hill
tt0482571,10,2024-01-04,The Prestige,https://www.imdb.com/title/tt0482571/,movie,8.5,130,2006,"Drama, Mystery, Sci-Fi, Thriller",1423525,2006-10-17,Christopher Nolan
tt4834206,9,2023-03-10,A Series of Unfortunate Events,https://www.imdb.com/title/tt4834206/,tvSeries,7.7,1164,2017,"Adventure, Comedy, Drama, Family, Mystery",66001,2017-01-11,
tt4844150,6,2023-03-23,A Babysitter's Guide to Monster Hunting,https://www.imdb.com/title/tt4844150/,movie,5.4,98,2020,"Comedy, Family, Fantasy",4832,2020-09-15,Rachel Talalay
tt0485947,10,2024-01-03,Mr. Nobody,https://www.imdb.com/title/tt0485947/,movie,7.7,141,2009,"Drama, Fantasy, Romance, Sci-Fi",244379,2009-09-11,Jaco Van Dormael
tt4869896,8,2022-06-21,Overlord,https://www.imdb.com/title/tt4869896/,tvSeries,7.7,30,2015,"Animation, Action, Adventure, Fantasy, Sci-Fi",13199,2015-07-06,
tt4877122,7,2021-10-30,The Emoji Movie,https://www.imdb.com/title/tt4877122/,movie,3.4,86,2017,"Animation, Adventure, Comedy, Family, Fantasy, Sci-Fi",70299,2017-07-27,Tony Leondis
tt4881806,7,2021-07-29,Jurassic World: Fallen Kingdom,https://www.imdb.com/title/tt4881806/,movie,6.1,128,2018,"Action, Adventure, Sci-Fi",339795,2018-05-21,J.A. Bayona
tt0489099,10,2021-10-07,Jumper,https://www.imdb.com/title/tt0489099/,movie,6.1,88,2008,"Action, Adventure, Sci-Fi, Thriller",321279,2008-02-06,Doug Liman
tt0490086,8,2022-12-26,Big Stan,https://www.imdb.com/title/tt0490086/,movie,6.1,105,2007,"Action, Comedy",46926,2007-11-05,Rob Schneider
tt4912910,9,2023-03-07,Mission: Impossible - Fallout,https://www.imdb.com/title/tt4912910/,movie,7.7,147,2018,"Action, Adventure, Thriller",373373,2018-07-12,Christopher McQuarrie
tt4955642,10,2020-06-28,The Good Place,https://www.imdb.com/title/tt4955642/,tvSeries,8.2,1303,2016,"Comedy, Drama, Fantasy, Mystery, Romance",185332,2016-09-19,
tt0499549,10,2021-07-22,Avatar,https://www.imdb.com/title/tt0499549/,movie,7.9,162,2009,"Action, Adventure, Fantasy, Sci-Fi",1374571,2009-12-10,James Cameron
tt5022702,9,2021-06-14,Hush,https://www.imdb.com/title/tt5022702/,movie,6.6,82,2016,"Horror, Thriller",151867,2016-03-12,Mike Flanagan
tt5034838,9,2023-03-23,Godzilla vs. Kong,https://www.imdb.com/title/tt5034838/,movie,6.3,113,2021,"Action, Sci-Fi, Thriller",233370,2021-03-24,Adam Wingard
tt5052448,10,2022-05-11,Get Out,https://www.imdb.com/title/tt5052448/,movie,7.8,104,2017,"Horror, Mystery, Thriller",683182,2017-01-23,Jordan Peele
tt5090568,8,2023-06-09,Transformers: Rise of the Beasts,https://www.imdb.com/title/tt5090568/,movie,6.0,127,2023,"Action, Adventure, Sci-Fi",98524,2023-05-27,Steven Caple Jr.
tt5095030,8,2021-11-04,Ant-Man and the Wasp,https://www.imdb.com/title/tt5095030/,movie,7.0,118,2018,"Action, Adventure, Comedy, Sci-Fi",444223,2018-06-25,Peyton Reed
tt5097410,8,2023-04-01,Noelle,https://www.imdb.com/title/tt5097410/,movie,6.3,100,2019,"Comedy, Family, Fantasy",26875,2019-11-08,Marc Lawrence
tt5104604,8,2019-11-23,Isle of Dogs,https://www.imdb.com/title/tt5104604/,movie,7.8,101,2018,"Animation, Adventure, Comedy, Drama, Sci-Fi",188434,2018-02-15,Wes Anderson
tt5108870,6,2022-05-14,Morbius,https://www.imdb.com/title/tt5108870/,movie,5.2,104,2022,"Action, Adventure, Horror, Sci-Fi, Thriller",148963,2022-03-23,Daniel Espinosa
tt5109280,8,2023-03-23,Raya and the Last Dragon,https://www.imdb.com/title/tt5109280/,movie,7.3,107,2021,"Animation, Action, Adventure, Comedy, Drama, Family, Fantasy",168855,2021-03-03,"Paul Briggs, Don Hall, Carlos López Estrada, John Ripa"
tt5113040,8,2021-05-19,The Secret Life of Pets 2,https://www.imdb.com/title/tt5113040/,movie,6.4,86,2019,"Animation, Adventure, Comedy, Family",68038,2019-05-24,"Chris Renaud, Jonathan del Val"
tt5113044,8,2022-08-02,Minions: The Rise of Gru,https://www.imdb.com/title/tt5113044/,movie,6.5,87,2022,"Animation, Adventure, Comedy, Crime, Family, Sci-Fi",82836,2022-06-13,"Brad Ableson, Kyle Balda, Jonathan del Val"
tt5117670,8,2021-12-25,Peter Rabbit,https://www.imdb.com/title/tt5117670/,movie,6.6,95,2018,"Animation, Adventure, Comedy, Drama, Family, Fantasy",47345,2018-02-03,Will Gluck
tt5164214,8,2023-03-07,Ocean's Eight,https://www.imdb.com/title/tt5164214/,movie,6.3,110,2018,"Action, Comedy, Crime",238928,2018-06-05,Gary Ross
tt5206260,7,2023-03-23,The Willoughbys,https://www.imdb.com/title/tt5206260/,movie,6.4,90,2020,"Animation, Adventure, Comedy, Family",21278,2020-04-22,"Rob Lodermeier, Kris Pearn, Cory Evans"
tt5220122,9,2021-12-25,Hotel Transylvania 3: Summer Vacation,https://www.imdb.com/title/tt5220122/,movie,6.3,97,2018,"Animation, Adventure, Comedy, Family, Fantasy, Horror",83781,2018-06-13,Genndy Tartakovsky
tt5308322,9,2022-05-12,Happy Death Day,https://www.imdb.com/title/tt5308322/,movie,6.6,96,2017,"Comedy, Horror, Mystery, Thriller",160161,2017-10-07,Christopher Landon
tt5311514,10,2022-08-27,Kimi no na wa.,https://www.imdb.com/title/tt5311514/,movie,8.4,106,2016,"Animation, Drama, Fantasy, Romance",311909,2016-07-03,Makoto Shinkai
tt5323662,10,2022-07-05,Koe no katachi,https://www.imdb.com/title/tt5323662/,movie,8.1,130,2016,"Animation, Drama",98227,2016-09-17,"Naoko Yamada, Taichi Ishidate"
tt5363618,8,2024-01-03,Sound of Metal,https://www.imdb.com/title/tt5363618/,movie,7.7,120,2019,"Drama, Music",147554,2019-09-06,Darius Marder
tt5363918,10,2020-12-03,Disenchantment,https://www.imdb.com/title/tt5363918/,tvSeries,7.2,30,2018,"Animation, Action, Adventure, Comedy, Fantasy",71774,2018-08-17,
tt5433138,5,2021-08-10,F9,https://www.imdb.com/title/tt5433138/,movie,5.2,143,2021,"Action, Crime, Thriller",159718,2021-05-19,Justin Lin
tt5433140,6,2023-06-12,Fast X,https://www.imdb.com/title/tt5433140/,movie,5.8,141,2023,"Action, Adventure, Crime, Mystery, Thriller",113339,2023-05-12,"Justin Lin, Louis Leterrier"
tt5442430,8,2022-03-19,Life,https://www.imdb.com/title/tt5442430/,movie,6.6,104,2017,"Horror, Sci-Fi, Thriller",249435,2017-03-18,Daniel Espinosa
tt5462602,7,2023-09-06,The Big Sick,https://www.imdb.com/title/tt5462602/,movie,7.5,120,2017,"Comedy, Drama, Romance",142529,2017-01-20,Michael Showalter
tt5463162,10,2021-07-22,Deadpool 2,https://www.imdb.com/title/tt5463162/,movie,7.6,119,2018,"Action, Adventure, Comedy, Sci-Fi",634108,2018-05-01,David Leitch
tt5515212,10,2020-04-10,Big Hero 6: The Series,https://www.imdb.com/title/tt5515212/,tvSeries,7.2,21,2017,"Animation, Action, Adventure, Comedy, Family, Sci-Fi",2471,2017-11-19,
tt5519340,7,2022-05-29,Bright,https://www.imdb.com/title/tt5519340/,movie,6.3,117,2017,"Action, Fantasy, Thriller",200248,2017-12-13,David Ayer
tt5562070,7,2021-09-05,Wish Dragon,https://www.imdb.com/title/tt5562070/,movie,7.2,98,2021,"Animation, Adventure, Comedy, Family, Fantasy, Romance",32725,2021-01-01,Chris Appelhans
tt5580540,10,2020-02-18,Santa Clarita Diet,https://www.imdb.com/title/tt5580540/,tvSeries,7.8,30,2017,"Comedy, Horror",75143,2017-01-20,
tt5638642,8,2024-01-26,The Ritual,https://www.imdb.com/title/tt5638642/,movie,6.3,94,2017,"Horror, Mystery, Thriller",116979,2017-09-08,David Bruckner
tt5640450,8,2023-10-16,ARQ,https://www.imdb.com/title/tt5640450/,movie,6.3,88,2016,"Action, Sci-Fi, Thriller",41498,2016-09-09,Tony Elliott
tt5687678,7,2023-10-20,FTL,https://www.imdb.com/title/tt5687678/,short,6.5,15,2017,"Short, Drama, Mystery, Sci-Fi",1080,2017-04-29,Adam Stern
tt5688932,8,2021-03-20,Sorry to Bother You,https://www.imdb.com/title/tt5688932/,movie,6.9,112,2018,"Comedy, Drama, Fantasy, Sci-Fi",87202,2018-01-20,Boots Riley
tt5691552,10,2022-06-02,The Orville,https://www.imdb.com/title/tt5691552/,tvSeries,8.0,44,2017,"Adventure, Comedy, Drama, Sci-Fi",98223,2017-09-10,
tt5709250,8,2022-11-14,Black Mirror: Arkangel,https://www.imdb.com/title/tt5709250/,tvEpisode,7.3,52,2017,"Drama, Mystery, Sci-Fi, Thriller",45936,2017-12-29,Jodie Foster
tt5710974,10,2022-11-14,Black Mirror: USS Callister,https://www.imdb.com/title/tt5710974/,tvEpisode,8.3,76,2017,"Drama, Mystery, Sci-Fi, Thriller",59292,2017-12-29,Toby Haynes
tt5710976,8,2022-11-14,Black Mirror: Crocodile,https://www.imdb.com/title/tt5710976/,tvEpisode,7.3,59,2017,"Drama, Mystery, Sci-Fi, Thriller",43415,2017-12-29,John Hillcoat
tt5726616,9,2023-05-17,Call Me by Your Name,https://www.imdb.com/title/tt5726616/,movie,7.8,132,2017,"Drama, Romance",307818,2017-01-22,Luca Guadagnino
tt5727208,5,2020-02-28,Uncut Gems,https://www.imdb.com/title/tt5727208/,movie,7.4,135,2019,"Crime, Drama, Thriller",313015,2019-08-30,"Josh Safdie, Benny Safdie"
tt5755238,9,2023-11-23,Leo,https://www.imdb.com/title/tt5755238/,movie,7.0,102,2023,"Animation, Comedy, Family, Musical",30087,2023-10-19,"Robert Marianetti, Robert Smigel, David Wachtenheim"
tt5758778,7,2022-03-20,Skyscraper,https://www.imdb.com/title/tt5758778/,movie,5.8,102,2018,"Action, Adventure, Thriller",132406,2018-07-11,Rawson Marshall Thurber
tt5814534,10,2020-03-01,Spies in Disguise,https://www.imdb.com/title/tt5814534/,movie,6.8,102,2019,"Animation, Action, Adventure, Comedy, Drama, Family, Sci-Fi, Thriller",55746,2019-12-04,"Nick Bruno, Troy Quane"
tt5834410,7,2024-02-04,The Tiger's Apprentice,https://www.imdb.com/title/tt5834410/,movie,5.5,84,2024,"Animation, Action, Adventure, Comedy, Family, Fantasy, Thriller",353,2024-02-02,"Paul Watling, Yong Duk Jhun, Raman Hui"
tt5834426,6,2022-03-29,Moonfall,https://www.imdb.com/title/tt5834426/,movie,5.1,130,2022,"Action, Adventure, Sci-Fi",96998,2022-02-02,Roland Emmerich
tt5848272,9,2021-12-25,Ralph Breaks the Internet,https://www.imdb.com/title/tt5848272/,movie,7.0,112,2018,"Animation, Adventure, Comedy, Family, Fantasy, Sci-Fi",179965,2018-11-05,"Rich Moore, Phil Johnston"
tt5865326,8,2021-10-08,The Laundromat,https://www.imdb.com/title/tt5865326/,movie,6.3,96,2019,"Comedy, Crime, Drama, History",54484,2019-09-01,Steven Soderbergh
tt5884052,9,2022-02-04,Pokémon: Detective Pikachu,https://www.imdb.com/title/tt5884052/,movie,6.5,104,2019,"Action, Adventure, Comedy, Family, Mystery, Sci-Fi",180674,2019-05-02,Rob Letterman
tt5886046,8,2022-08-21,Escape Room,https://www.imdb.com/title/tt5886046/,movie,6.4,99,2019,"Action, Adventure, Horror, Mystery, Sci-Fi, Thriller",139689,2019-01-02,Adam Robitel
tt5897304,9,2023-01-08,Mob Psycho 100,https://www.imdb.com/title/tt5897304/,tvSeries,8.6,24,2016,"Animation, Action, Comedy, Drama, Fantasy, Horror, Sci-Fi",43146,2016-07-11,
tt5971474,8,2023-09-21,The Little Mermaid,https://www.imdb.com/title/tt5971474/,movie,7.2,135,2023,"Adventure, Family, Fantasy, Musical, Romance",151806,2023-05-08,Rob Marshall
tt5979872,7,2021-08-16,Bleach: Burîchu,https://www.imdb.com/title/tt5979872/,movie,6.3,108,2018,"Action, Adventure, Fantasy",12740,2018-07-20,Shinsuke Sato
tt5979874,8,2021-10-09,Gojira: Kaijû Wakusei,https://www.imdb.com/title/tt5979874/,movie,6.0,89,2017,"Animation, Action, Adventure, Sci-Fi",9352,2017-11-17,"Hiroyuki Seshita, Kôbun Shizuno"
tt5990444,6,2022-01-10,The Trap,https://www.imdb.com/title/tt5990444/,movie,4.3,90,2019,Comedy,1931,2019-04-01,Erik White
tt6048930,8,2024-01-20,Naked,https://www.imdb.com/title/tt6048930/,movie,5.4,96,2017,"Comedy, Fantasy, Romance",21439,2017-08-11,Michael Tiddes
tt6053938,7,2023-02-21,Las leyes de la termodinámica,https://www.imdb.com/title/tt6053938/,movie,6.0,100,2018,Comedy,2914,2018-03-13,Mateo Gil
tt6087226,6,2024-01-24,Koma,https://www.imdb.com/title/tt6087226/,movie,6.3,111,2019,"Action, Adventure, Mystery, Sci-Fi",11454,2019-11-19,Nikita Argunov
tt6095472,8,2021-12-25,The Angry Birds Movie 2,https://www.imdb.com/title/tt6095472/,movie,6.4,97,2019,"Animation, Action, Adventure, Comedy, Family",34418,2019-08-02,"Thurop Van Orman, John Rice"
tt6105098,8,2021-12-25,The Lion King,https://www.imdb.com/title/tt6105098/,movie,6.8,118,2019,"Animation, Adventure, Drama, Family, Musical",264504,2019-07-09,Jon Favreau
tt6139732,9,2020-01-25,Aladdin,https://www.imdb.com/title/tt6139732/,movie,6.9,128,2019,"Adventure, Comedy, Family, Fantasy, Musical, Romance",287017,2019-05-08,Guy Ritchie
tt6146586,9,2021-11-15,John Wick: Chapter 3 - Parabellum,https://www.imdb.com/title/tt6146586/,movie,7.4,130,2019,"Action, Crime, Thriller",419292,2019-05-15,Chad Stahelski
tt6166392,8,2024-01-22,Wonka,https://www.imdb.com/title/tt6166392/,movie,7.2,116,2023,"Adventure, Comedy, Family, Fantasy, Musical",86219,2023-11-28,Paul King
tt6182908,8,2023-03-23,Smallfoot,https://www.imdb.com/title/tt6182908/,movie,6.6,96,2018,"Animation, Adventure, Comedy, Drama, Family, Fantasy, Musical",42547,2018-09-20,"Jason Reisig, Karey Kirkpatrick"
tt6189022,8,2023-01-09,Angel Has Fallen,https://www.imdb.com/title/tt6189022/,movie,6.4,121,2019,"Action, Thriller",108765,2019-08-20,Ric Roman Waugh
tt6193336,10,2020-05-09,The Hollow,https://www.imdb.com/title/tt6193336/,tvSeries,7.2,24,2018,"Animation, Adventure, Drama, Family, Mystery, Sci-Fi",4865,2018-06-08,
tt6197070,4,2020-08-12,Blood Machines,https://www.imdb.com/title/tt6197070/,movie,6.1,50,2019,"Adventure, Music, Sci-Fi",3835,2019-09-14,"Savitri Joly-Gonfard, Seth Ickerman, Raphaël Hernandez"
tt6257970,10,2022-04-29,The End of the F***ing World,https://www.imdb.com/title/tt6257970/,tvSeries,8.0,25,2017,"Adventure, Comedy, Crime, Drama, Romance, Thriller",215999,2017-10-24,
tt0062622,10,2023-01-02,2001: A Space Odyssey,https://www.imdb.com/title/tt0062622/,movie,8.3,149,1968,"Adventure, Sci-Fi",711272,1968-04-02,Stanley Kubrick
tt6264654,10,2021-08-11,Free Guy,https://www.imdb.com/title/tt6264654/,movie,7.1,115,2021,"Action, Adventure, Comedy, Fantasy, Sci-Fi",416690,2021-08-10,Shawn Levy
tt6292852,6,2023-06-11,I Am Mother,https://www.imdb.com/title/tt6292852/,movie,6.7,113,2019,"Drama, Mystery, Sci-Fi, Thriller",98271,2019-01-25,Grant Sputore
tt6317068,10,2021-01-03,Final Space,https://www.imdb.com/title/tt6317068/,tvSeries,8.2,30,2018,"Animation, Action, Adventure, Comedy, Drama, Fantasy, Sci-Fi",47942,2018-02-26,
tt6320628,10,2021-11-04,Spider-Man: Far from Home,https://www.imdb.com/title/tt6320628/,movie,7.4,129,2019,"Action, Adventure, Comedy, Fantasy, Sci-Fi",546930,2019-06-26,Jon Watts
tt6324278,8,2023-03-23,Abominable,https://www.imdb.com/title/tt6324278/,movie,7.0,97,2019,"Animation, Adventure, Comedy, Family, Fantasy",42022,2019-09-07,"Todd Wilderman, Jill Culton"
tt6334354,9,2021-11-11,The Suicide Squad,https://www.imdb.com/title/tt6334354/,movie,7.2,132,2021,"Action, Adventure, Comedy, Sci-Fi",401230,2021-07-28,James Gunn
tt6348138,8,2021-12-25,Missing Link,https://www.imdb.com/title/tt6348138/,movie,6.7,93,2019,"Animation, Adventure, Comedy, Family, Fantasy",28488,2019-04-04,Chris Butler
tt6385540,10,2021-12-08,Hilda,https://www.imdb.com/title/tt6385540/,tvSeries,8.6,,2018,"Animation, Adventure, Comedy, Family, Fantasy, Mystery",13477,2018-02-25,
tt6386204,9,2023-10-10,CTRL Z,https://www.imdb.com/title/tt6386204/,short,7.5,21,2017,"Short, Comedy",276,2017-02-17,James Kennedy
tt6392192,4,2023-03-07,The Legend of Korra: A New Beginning,https://www.imdb.com/title/tt6392192/,short,4.7,9,2017,"Short, Action",94,2017-01-05,Joey Min
