Const,Your Rating,Date Rated,Title,URL,Title Type,IMDb Rating,Runtime (mins),Year,Genres,Num Votes,Release Date,Directors
tt2582802,10,2024-01-06,Whiplash,https://www.imdb.com/title/tt2582802/,movie,8.5,106,2014,"Drama, Music",967588,2014-01-16,Damien Chazelle
tt2584384,8,2022-04-12,Jojo Rabbit,https://www.imdb.com/title/tt2584384/,movie,7.9,108,2019,"Comedy, Drama, War",433824,2019-09-08,Taika Waititi
tt0258463,8,2021-11-01,The Bourne Identity,https://www.imdb.com/title/tt0258463/,movie,7.8,119,2002,"Action, Mystery, Thriller",571853,2002-06-06,Doug Liman
tt2637294,8,2022-03-27,Hot Tub Time Machine 2,https://www.imdb.com/title/tt2637294/,movie,5.0,93,2015,"Comedy, Mystery, Sci-Fi",41312,2015-02-20,Steve Pink
tt0263757,7,2023-11-17,Uptown Girls,https://www.imdb.com/title/tt0263757/,movie,6.2,92,2003,"Comedy, Drama, Romance",42451,2003-08-15,Boaz Yakin
tt0264464,10,2020-08-18,Catch Me If You Can,https://www.imdb.com/title/tt0264464/,movie,8.1,141,2002,"Biography, Crime, Drama",1077745,2002-12-16,Steven Spielberg
tt0265208,8,2022-12-27,The Girl Next Door,https://www.imdb.com/title/tt0265208/,movie,6.7,109,2004,"Comedy, Drama, Romance",237559,2004-02-18,Luke Greenfield
tt0265298,8,2020-06-10,Big Fat Liar,https://www.imdb.com/title/tt0265298/,movie,5.5,88,2002,"Adventure, Comedy, Family",39184,2002-02-02,Shawn Levy
tt26547864,7,2023-11-12,Konferensen,https://www.imdb.com/title/tt26547864/,movie,5.7,100,2023,"Comedy, Horror, Mystery, Thriller",10571,2023-10-13,Patrik Eklund
tt2660888,9,2022-09-19,Star Trek Beyond,https://www.imdb.com/title/tt2660888/,movie,7.0,122,2016,"Action, Adventure, Sci-Fi, Thriller",256883,2016-07-20,Justin Lin
tt0266308,9,2022-05-15,Batoru rowaiaru,https://www.imdb.com/title/tt0266308/,movie,7.5,114,2000,"Action, Adventure, Drama, Thriller",193040,2000-10-31,Kinji Fukasaku
tt0266543,10,2021-07-06,Finding Nemo,https://www.imdb.com/title/tt0266543/,movie,8.2,100,2003,"Animation, Adventure, Comedy, Family",1101862,2003-05-18,"Andrew Stanton, Lee Unkrich"
tt0266915,8,2023-03-07,Rush Hour 2,https://www.imdb.com/title/tt0266915/,movie,6.7,90,2001,"Action, Comedy, Crime, Thriller",236644,2001-07-26,Brett Ratner
tt0268380,10,2021-07-06,Ice Age,https://www.imdb.com/title/tt0268380/,movie,7.5,81,2002,"Animation, Adventure, Comedy, Family",513172,2002-03-12,"Chris Wedge, Carlos Saldanha"
tt2704998,8,2021-10-03,Game Night,https://www.imdb.com/title/tt2704998/,movie,6.9,100,2018,"Action, Adventure, Comedy, Crime, Thriller",253130,2018-02-15,"John Francis Daley, Jonathan Goldstein"
tt2709692,8,2021-12-25,The Grinch,https://www.imdb.com/title/tt2709692/,movie,6.4,85,2018,"Animation, Comedy, Family, Fantasy, Musical",90052,2018-11-03,"Yarrow Cheney, Scott Mosier"
tt2709768,8,2021-12-25,The Secret Life of Pets,https://www.imdb.com/title/tt2709768/,movie,6.5,87,2016,"Animation, Adventure, Comedy, Family",215222,2016-06-16,Chris Renaud
tt27155038,8,2023-07-23,"Ruby Gillman, Teenage Kraken",https://www.imdb.com/title/tt27155038/,movie,5.7,91,2023,"Animation, Action, Adventure, Comedy, Family, Fantasy",9126,2023-06-15,"Kirk DeMicco, Faryn Pearl"
tt27402062,10,2024-02-02,Roboquest,https://www.imdb.com/title/tt27402062/,videoGame,7.4,,2020,,12,2020-06-22,
tt0274166,8,2022-12-28,Johnny English,https://www.imdb.com/title/tt0274166/,movie,6.2,89,2003,"Action, Adventure, Comedy",172756,2003-04-06,Peter Howitt
tt0274812,6,2023-04-03,Secretary,https://www.imdb.com/title/tt0274812/,movie,6.9,107,2002,"Comedy, Drama, Romance",97581,2002-01-11,Steven Shainberg
tt0277371,6,2023-05-01,Not Another Teen Movie,https://www.imdb.com/title/tt0277371/,movie,5.8,89,2001,Comedy,114506,2001-12-07,Joel Gallen
tt2781042,9,2023-10-22,Sherlock: The Sign of Three,https://www.imdb.com/title/tt2781042/,tvEpisode,8.9,86,2014,"Crime, Drama, Mystery, Thriller",28544,2014-01-05,Colm McCarthy
tt2781046,10,2023-10-23,Sherlock: His Last Vow,https://www.imdb.com/title/tt2781046/,tvEpisode,9.2,89,2014,"Crime, Drama, Mystery, Thriller",31663,2014-01-12,Nick Hurran
tt2788710,8,2023-03-23,The Interview,https://www.imdb.com/title/tt2788710/,movie,6.5,112,2014,"Action, Adventure, Comedy",351135,2014-12-11,"Evan Goldberg, Seth Rogen"
tt2788732,8,2021-12-25,Pete's Dragon,https://www.imdb.com/title/tt2788732/,movie,6.7,102,2016,"Action, Adventure, Comedy, Drama, Family, Fantasy",61301,2016-07-31,David Lowery
tt27936453,9,2023-11-12,Kage no Jitsuryokusha ni Naritakute!: The Lawless City,https://www.imdb.com/title/tt27936453/,tvEpisode,8.0,,2023,"Animation, Action, Adventure, Comedy, Fantasy",398,2023-10-04,Kazuya Nakanishi
tt2798920,9,2021-06-06,Annihilation,https://www.imdb.com/title/tt2798920/,movie,6.8,115,2018,"Adventure, Drama, Horror, Mystery, Sci-Fi, Thriller",355843,2018-02-13,Alex Garland
tt2802144,8,2021-07-22,Kingsman: The Secret Service,https://www.imdb.com/title/tt2802144/,movie,7.7,129,2014,"Action, Adventure, Comedy, Thriller",708832,2014-12-13,Matthew Vaughn
tt28035641,10,2024-01-31,Once Upon a Studio,https://www.imdb.com/title/tt28035641/,short,8.4,9,2023,"Animation, Short, Comedy, Family, Fantasy, Musical",6252,2023-06-11,"Dan Abraham, Trent Correy"
tt28066777,7,2024-02-03,Orion and the Dark,https://www.imdb.com/title/tt28066777/,movie,6.5,93,2024,"Animation, Adventure, Comedy, Family, Fantasy, Mystery",2710,2024-02-02,Sean Charmatz
tt28079572,9,2024-01-25,"Percy Jackson and the Olympians: We Find Out the Truth, Sort Of",https://www.imdb.com/title/tt28079572/,tvEpisode,7.7,41,2024,"Action, Adventure, Family, Fantasy",1953,2024-01-23,Anders Engström
tt28104766,8,2023-12-09,Squid Game: The Challenge,https://www.imdb.com/title/tt28104766/,tvSeries,5.8,60,2023,"Game-Show, Reality-TV",15799,2023-11-22,
tt28250641,9,2023-11-09,Undead Unluck: Undead and Unluck,https://www.imdb.com/title/tt28250641/,tvEpisode,7.9,24,2023,"Animation, Action, Adventure, Comedy, Fantasy, Sci-Fi",308,2023-10-06,Yûki Yase
tt28485898,9,2023-10-26,Gen V: #ThinkBrink,https://www.imdb.com/title/tt28485898/,tvEpisode,8.0,52,2023,"Action, Adventure, Comedy, Drama, Sci-Fi",5640,2023-09-28,Philip Sgriccia
tt28485900,7,2023-10-26,Gen V: First Day,https://www.imdb.com/title/tt28485900/,tvEpisode,7.5,49,2023,"Action, Adventure, Comedy, Drama, Sci-Fi",5400,2023-09-28,Nelson Cragg
tt28485903,8,2023-10-26,Gen V: The Whole Truth,https://www.imdb.com/title/tt28485903/,tvEpisode,7.7,47,2023,"Action, Adventure, Comedy, Drama, Sci-Fi",4996,2023-10-05,Steve Boyum
tt28485904,8,2023-10-26,Gen V: Welcome to the Monster Club,https://www.imdb.com/title/tt28485904/,tvEpisode,7.7,41,2023,"Action, Adventure, Comedy, Drama, Sci-Fi",4683,2023-10-12,Clare Kilner
tt28485906,8,2023-10-26,Gen V: Jumanji,https://www.imdb.com/title/tt28485906/,tvEpisode,7.7,40,2023,"Action, Adventure, Comedy, Drama, Sci-Fi",4471,2023-10-19,Rachel Goldberg
tt28485908,9,2023-11-03,Gen V: Sick,https://www.imdb.com/title/tt28485908/,tvEpisode,8.3,48,2023,"Action, Adventure, Comedy, Drama, Sci-Fi",4470,2023-10-26,Shana Stein
tt28485909,10,2023-11-03,Gen V: Guardians of Godolkin,https://www.imdb.com/title/tt28485909/,tvEpisode,8.5,39,2023,"Action, Adventure, Comedy, Drama, Sci-Fi",5065,2023-11-03,Sanaa Hamri
tt2850386,10,2021-01-03,The Croods: A New Age,https://www.imdb.com/title/tt2850386/,movie,6.9,95,2020,"Animation, Adventure, Comedy, Family, Fantasy",52006,2020-11-25,Joel Crawford
tt2854926,9,2021-10-09,Tag,https://www.imdb.com/title/tt2854926/,movie,6.5,100,2018,"Action, Comedy",145194,2018-06-14,Jeff Tomsic
tt28575745,9,2024-02-02,Brotato,https://www.imdb.com/title/tt28575745/,videoGame,7.7,,2022,Action,17,2022-09-27,
tt2861424,10,2019-11-18,Rick and Morty,https://www.imdb.com/title/tt2861424/,tvSeries,9.1,23,2013,"Animation, Adventure, Comedy, Sci-Fi",591217,2013-12-02,
tt2866360,8,2023-02-21,Coherence,https://www.imdb.com/title/tt2866360/,movie,7.2,89,2013,"Drama, Mystery, Sci-Fi, Thriller",143677,2013-09-19,James Ward Byrkit
tt2872718,9,2022-08-09,Nightcrawler,https://www.imdb.com/title/tt2872718/,movie,7.8,117,2014,"Crime, Drama, Thriller",596852,2014-09-05,Dan Gilroy
tt2872732,10,2021-08-09,Lucy,https://www.imdb.com/title/tt2872732/,movie,6.4,89,2014,"Action, Sci-Fi, Thriller",529309,2014-07-25,Luc Besson
tt2883512,10,2020-09-09,Chef,https://www.imdb.com/title/tt2883512/,movie,7.3,114,2014,"Adventure, Comedy, Drama",229470,2014-03-07,Jon Favreau
tt2906216,10,2023-05-02,Dungeons & Dragons: Honor Among Thieves,https://www.imdb.com/title/tt2906216/,movie,7.3,134,2023,"Action, Adventure, Comedy, Fantasy",216341,2023-03-10,"John Francis Daley, Jonathan Goldstein"
tt2908446,9,2023-02-14,Insurgent,https://www.imdb.com/title/tt2908446/,movie,6.2,119,2015,"Action, Adventure, Sci-Fi, Thriller",252600,2015-03-11,Robert Schwentke
tt2911666,8,2022-09-30,John Wick,https://www.imdb.com/title/tt2911666/,movie,7.4,101,2014,"Action, Crime, Thriller",730725,2014-09-19,"David Leitch, Chad Stahelski"
tt29174029,10,2023-10-29,Big Mouth: The International Show,https://www.imdb.com/title/tt29174029/,tvEpisode,7.2,28,2023,"Animation, Comedy, Romance",352,2023-10-20,Alex Salyer
tt29277814,8,2023-11-29,Sôsô no Furîren: Betsuni mahô janakutatte...,https://www.imdb.com/title/tt29277814/,tvEpisode,8.3,26,2023,"Animation, Adventure, Drama, Fantasy",903,2023-09-29,"Tomoya Kitagawa, Keiichirô Saitô"
tt29277815,8,2023-11-29,Sôsô no Furîren: Hito o korosu mahô,https://www.imdb.com/title/tt29277815/,tvEpisode,8.3,25,2023,"Animation, Adventure, Drama, Fantasy",851,2023-09-29,"Daiki Harashina, Keiichirô Saitô"
tt0293429,8,2021-04-24,Mortal Kombat,https://www.imdb.com/title/tt0293429/,movie,6.0,110,2021,"Action, Adventure, Fantasy, Sci-Fi, Thriller",188083,2021-04-07,Simon McQuoid
tt29355981,9,2023-11-09,"Shangri-La Frontier: Kusoge Hunter, Kamige ni Idoman to su: What Do You Play Games For?",https://www.imdb.com/title/tt29355981/,tvEpisode,7.5,26,2023,"Animation, Action, Adventure, Fantasy",119,2023-10-01,
tt2935622,6,2023-03-19,The School for Good and Evil,https://www.imdb.com/title/tt2935622/,movie,5.9,147,2022,"Action, Comedy, Drama, Fantasy",35047,2022-10-19,Paul Feig
tt0293564,7,2023-03-19,Rush Hour 3,https://www.imdb.com/title/tt0293564/,movie,6.2,91,2007,"Action, Comedy, Crime, Thriller",181496,2007-07-30,Brett Ratner
tt29358839,9,2023-11-09,"Shangri-La Frontier: Kusoge Hunter, Kamige ni Idoman to su: A Peculiar One",https://www.imdb.com/title/tt29358839/,tvEpisode,7.7,26,2023,"Animation, Action, Adventure, Fantasy",107,2023-10-08,
tt29358871,10,2023-11-09,"Shangri-La Frontier: Kusoge Hunter, Kamige ni Idoman to su: Black Wolf Nightslayer",https://www.imdb.com/title/tt29358871/,tvEpisode,8.1,26,2023,"Animation, Action, Adventure, Fantasy",91,2023-10-15,
tt29358954,8,2023-11-12,"Shangri-La Frontier: Kusoge Hunter, Kamige ni Idoman to su: A Trash Game Realignment of Elevated Tastes",https://www.imdb.com/title/tt29358954/,tvEpisode,7.6,26,2023,"Animation, Action, Adventure, Fantasy",80,2023-10-22,
tt29359032,9,2023-11-09,"Shangri-La Frontier: Kusoge Hunter, Kamige ni Idoman to su: Lo, Thou Art Assailed on All Sides",https://www.imdb.com/title/tt29359032/,tvEpisode,7.9,26,2023,"Animation, Action, Adventure, Fantasy",75,2023-10-29,
tt29359035,9,2023-11-12,"Shangri-La Frontier: Kusoge Hunter, Kamige ni Idoman to su: The Writing Tool Knight-Queen",https://www.imdb.com/title/tt29359035/,tvEpisode,7.9,26,2023,"Animation, Action, Adventure, Fantasy",70,2023-11-05,
tt29359040,8,2023-11-13,"Shangri-La Frontier: Kusoge Hunter, Kamige ni Idoman to su: Remnant of the Divinity: The Aberrant Loser",https://www.imdb.com/title/tt29359040/,tvEpisode,7.5,26,2023,"Animation, Action, Adventure, Fantasy",65,2023-11-12,
tt29359046,8,2023-11-20,"Shangri-La Frontier: Kusoge Hunter, Kamige ni Idoman to su: The 300-Limit Pandemonium",https://www.imdb.com/title/tt29359046/,tvEpisode,7.4,26,2023,"Animation, Action, Adventure, Fantasy",63,2023-11-19,
tt2937366,7,2022-11-29,Little Evil,https://www.imdb.com/title/tt2937366/,movie,5.7,94,2017,"Comedy, Fantasy, Horror",23098,2017-09-01,Eli Craig
tt29389859,9,2023-11-12,Kage no Jitsuryokusha ni Naritakute!: The Haven,https://www.imdb.com/title/tt29389859/,tvEpisode,7.9,,2023,"Animation, Action, Adventure, Comedy, Fantasy",323,2023-10-11,"Kazuya Nakanishi, Daisuke Takashima"
tt29409202,9,2024-01-21,Bucchigiri?!: Merge?! Fall in Love with Fortune Bang Bang Chicken!,https://www.imdb.com/title/tt29409202/,tvEpisode,8.4,,2024,"Animation, Action, Adventure, Comedy, Fantasy",78,2024-01-13,
tt29438081,9,2023-11-09,Undead Unluck: Union,https://www.imdb.com/title/tt29438081/,tvEpisode,7.7,24,2023,"Animation, Action, Adventure, Comedy, Fantasy, Sci-Fi",240,2023-10-13,Yûki Yase
tt29451855,9,2023-11-09,Undead Unluck: How to Use My Unluck,https://www.imdb.com/title/tt29451855/,tvEpisode,7.4,24,2023,"Animation, Action, Adventure, Comedy, Fantasy, Sci-Fi",218,2023-10-20,Yûki Yase
tt29451856,10,2023-11-09,Undead Unluck: Do You Love the Change in Me?,https://www.imdb.com/title/tt29451856/,tvEpisode,8.4,24,2023,"Animation, Action, Adventure, Comedy, Fantasy, Sci-Fi",241,2023-10-27,Yûki Yase
tt29451858,10,2023-11-09,Undead Unluck: United We Negate,https://www.imdb.com/title/tt29451858/,tvEpisode,7.5,24,2023,"Animation, Action, Adventure, Comedy, Fantasy, Sci-Fi",190,2023-11-03,Yûki Yase
tt29451860,8,2023-11-19,Undead Unluck: Spoil,https://www.imdb.com/title/tt29451860/,tvEpisode,7.7,24,2023,"Animation, Action, Adventure, Comedy, Fantasy, Sci-Fi",176,2023-11-10,Yûki Yase
tt29451861,9,2023-11-19,Undead Unluck: Dream,https://www.imdb.com/title/tt29451861/,tvEpisode,7.8,24,2023,"Animation, Action, Adventure, Comedy, Fantasy, Sci-Fi",196,2023-11-17,Yûki Yase
tt29451862,10,2023-12-04,Undead Unluck: Return,https://www.imdb.com/title/tt29451862/,tvEpisode,8.8,24,2023,"Animation, Action, Adventure, Comedy, Fantasy, Sci-Fi",162,2023-12-01,Yûki Yase
tt29451864,9,2023-11-28,Undead Unluck: Victhor,https://www.imdb.com/title/tt29451864/,tvEpisode,8.4,24,2023,"Animation, Action, Adventure, Comedy, Fantasy, Sci-Fi",241,2023-11-24,"Yûki Yase, Katsuichi Nakayama"
tt29451865,9,2023-12-12,Undead Unluck: Result,https://www.imdb.com/title/tt29451865/,tvEpisode,8.2,24,2023,"Animation, Action, Adventure, Comedy, Fantasy, Sci-Fi",142,2023-12-08,Yûki Yase
tt29473597,10,2023-11-12,Kage no Jitsuryokusha ni Naritakute!: The Hour Of Awakening,https://www.imdb.com/title/tt29473597/,tvEpisode,8.5,,2023,"Animation, Action, Adventure, Comedy, Fantasy",329,2023-10-18,Kazuya Nakanishi
tt2948356,10,2021-07-06,Zootopia,https://www.imdb.com/title/tt2948356/,movie,8.0,108,2016,"Animation, Adventure, Comedy, Crime, Family, Mystery",538810,2016-02-10,"Rich Moore, Jared Bush, Byron Howard"
tt2948372,8,2023-03-23,Soul,https://www.imdb.com/title/tt2948372/,movie,8.0,100,2020,"Animation, Adventure, Comedy, Drama, Family, Fantasy, Music",372051,2020-10-11,"Pete Docter, Kemp Powers"
tt0295297,8,2021-11-15,Harry Potter and the Chamber of Secrets,https://www.imdb.com/title/tt0295297/,movie,7.4,161,2002,"Adventure, Family, Fantasy, Mystery",684583,2002-11-03,Chris Columbus
tt2953050,9,2021-12-23,Encanto,https://www.imdb.com/title/tt2953050/,movie,7.2,102,2021,"Animation, Comedy, Family, Fantasy, Musical",256360,2021-11-03,"Jared Bush, Charise Castro Smith, Byron Howard"
tt29535567,8,2023-11-12,Kage no Jitsuryokusha ni Naritakute!: Mask of Falsehood,https://www.imdb.com/title/tt29535567/,tvEpisode,7.7,,2023,"Animation, Action, Adventure, Comedy, Fantasy",216,2023-10-25,"Kazuya Nakanishi, Daisuke Takashima"
tt2974918,7,2022-11-18,Alvin and the Chipmunks: The Road Chip,https://www.imdb.com/title/tt2974918/,movie,4.9,92,2015,"Adventure, Comedy, Family, Fantasy, Music, Musical",22149,2015-12-06,Walt Becker
tt2980706,8,2024-01-19,Planes: Fire & Rescue,https://www.imdb.com/title/tt2980706/,movie,5.9,83,2014,"Animation, Adventure, Comedy, Family, Sport",19598,2014-07-15,Bobs Gannaway
tt0298130,9,2023-01-20,The Ring,https://www.imdb.com/title/tt0298130/,movie,7.1,115,2002,"Horror, Mystery",371713,2002-10-02,Gore Verbinski
tt0298148,8,2021-12-25,Shrek 2,https://www.imdb.com/title/tt0298148/,movie,7.3,93,2004,"Animation, Adventure, Comedy, Family, Fantasy, Romance",498919,2004-05-08,"Conrad Vernon, Kelly Asbury, Andrew Adamson"
tt2981768,10,2022-11-20,Sakasama no Patema,https://www.imdb.com/title/tt2981768/,movie,7.3,98,2013,"Animation, Adventure, Drama, Fantasy, Romance, Sci-Fi",10093,2013-06-13,Yasuhiro Yoshiura
tt0298203,10,2021-07-15,8 Mile,https://www.imdb.com/title/tt0298203/,movie,7.2,110,2002,"Drama, Music",316803,2002-09-08,Curtis Hanson
tt2990140,8,2020-11-26,The Christmas Chronicles,https://www.imdb.com/title/tt2990140/,movie,7.0,104,2018,"Adventure, Comedy, Family, Fantasy",83087,2018-11-21,Clay Kaytis
tt3014284,7,2022-02-04,The Lego Ninjago Movie,https://www.imdb.com/title/tt3014284/,movie,6.0,101,2017,"Animation, Action, Adventure, Comedy, Drama, Family, Fantasy, Sci-Fi, Thriller",29518,2017-09-20,"Paul Fisher, Bob Logan, Charlie Bean"
tt0302640,7,2022-12-26,The Hot Chick,https://www.imdb.com/title/tt0302640/,movie,5.6,104,2002,"Comedy, Fantasy",101695,2002-12-02,Tom Brady
tt0304141,8,2021-11-15,Harry Potter and the Prisoner of Azkaban,https://www.imdb.com/title/tt0304141/,movie,7.9,142,2004,"Adventure, Family, Fantasy, Mystery",683420,2004-05-23,Alfonso Cuarón
tt30446469,7,2024-01-27,Love is Blind: Sverige: Will You Marry Me?,https://www.imdb.com/title/tt30446469/,tvEpisode,6.6,66,2024,"Game-Show, Reality-TV, Romance",17,2024-01-12,
tt30446470,6,2024-01-27,Love is Blind: Sverige: First Night Together,https://www.imdb.com/title/tt30446470/,tvEpisode,6.3,55,2024,"Game-Show, Reality-TV, Romance",16,2024-01-12,
tt30446471,7,2024-01-28,Love is Blind: Sverige: Physical Attraction,https://www.imdb.com/title/tt30446471/,tvEpisode,6.3,55,2024,"Game-Show, Reality-TV, Romance",16,2024-01-12,
tt30446482,9,2024-01-28,Love is Blind: Sverige: The Bad Boy Always Wins,https://www.imdb.com/title/tt30446482/,tvEpisode,7.7,48,2024,"Game-Show, Reality-TV, Romance",17,2024-01-19,
tt30446483,7,2024-01-28,Love is Blind: Sverige: Waking Up Alone,https://www.imdb.com/title/tt30446483/,tvEpisode,7.5,43,2024,"Game-Show, Reality-TV, Romance",13,2024-01-19,
tt30446484,8,2024-01-28,Love is Blind: Sverige: Time to Move in Together,https://www.imdb.com/title/tt30446484/,tvEpisode,7.5,55,2024,"Game-Show, Reality-TV, Romance",14,2024-01-19,
tt30446489,8,2024-01-28,Love is Blind: Sverige: Is It True Love?,https://www.imdb.com/title/tt30446489/,tvEpisode,7.2,49,2024,"Game-Show, Reality-TV, Romance",16,2024-01-19,
tt3065204,8,2023-01-26,The Conjuring 2,https://www.imdb.com/title/tt3065204/,movie,7.3,134,2016,"Horror, Mystery, Thriller",296790,2016-05-13,James Wan
tt3072482,8,2023-03-27,Hardcore Henry,https://www.imdb.com/title/tt3072482/,movie,6.7,96,2015,"Action, Adventure, Sci-Fi, Thriller",101087,2015-09-12,Ilya Naishuller
tt0307453,7,2020-09-29,Shark Tale,https://www.imdb.com/title/tt0307453/,movie,6.0,90,2004,"Animation, Adventure, Comedy, Family, Thriller",196916,2004-09-10,"Bibo Bergeron, Vicky Jenson, Rob Letterman"
tt3076658,9,2023-03-23,Creed,https://www.imdb.com/title/tt3076658/,movie,7.6,133,2015,"Action, Drama, Sport",307844,2015-11-19,Ryan Coogler
tt3079380,8,2023-03-23,Spy,https://www.imdb.com/title/tt3079380/,movie,7.0,120,2015,"Action, Comedy",256884,2015-03-15,Paul Feig
tt0307987,8,2023-03-21,Bad Santa,https://www.imdb.com/title/tt0307987/,movie,7.1,92,2003,"Comedy, Crime, Drama",154518,2003-11-18,Terry Zwigoff
tt30801754,8,2024-01-13,Ore dake Level Up na Ken: If I Had One More Chance,https://www.imdb.com/title/tt30801754/,tvEpisode,9.2,24,2024,"Animation, Action, Adventure, Fantasy",2994,2024-01-13,Shunsuke Nakashige
tt30869507,9,2024-01-21,Ore dake Level Up na Ken: It's Like a Game,https://www.imdb.com/title/tt30869507/,tvEpisode,8.1,24,2024,"Animation, Action, Adventure, Fantasy",1480,2024-01-20,
tt30869508,10,2024-01-28,Ore dake Level Up na Ken: I've Gotta Get Stronger,https://www.imdb.com/title/tt30869508/,tvEpisode,8.9,24,2024,"Animation, Action, Adventure, Fantasy",1452,2024-01-27,
tt30869509,8,2024-02-03,Ore dake Level Up na Ken: Episode #1.5,https://www.imdb.com/title/tt30869509/,tvEpisode,8.1,,2024,"Animation, Action, Adventure, Fantasy",620,2024-02-03,
tt30887986,8,2024-01-21,Bucchigiri?!: Wanna Take You On! The Chu Chu Chinese Pepper Steak Train!,https://www.imdb.com/title/tt30887986/,tvEpisode,8.1,,2024,"Animation, Action, Adventure, Comedy, Fantasy",58,2024-01-20,Hiroko Utsumi
tt0309593,6,2023-07-26,Final Destination 2,https://www.imdb.com/title/tt0309593/,movie,6.2,90,2003,"Horror, Thriller",180171,2003-01-30,David R. Ellis
tt3107288,8,2022-12-14,The Flash,https://www.imdb.com/title/tt3107288/,tvSeries,7.5,43,2014,"Action, Adventure, Drama, Sci-Fi",366310,2014-10-07,
tt3110958,9,2023-02-14,Now You See Me 2,https://www.imdb.com/title/tt3110958/,movie,6.4,129,2016,"Action, Adventure, Comedy, Crime, Mystery, Thriller",316946,2016-06-02,Jon M. Chu
tt3118452,6,2020-03-29,Circle,https://www.imdb.com/title/tt3118452/,movie,6.0,87,2015,"Drama, Horror, Mystery, Sci-Fi, Thriller",65177,2015-05-28,"Mario Miscione, Aaron Hann"
tt0312004,9,2023-01-10,The Curse of the Were-Rabbit,https://www.imdb.com/title/tt0312004/,movie,7.5,85,2005,"Animation, Adventure, Comedy, Family, Fantasy, Mystery, Sci-Fi",145111,2005-09-04,"Nick Park, Steve Box"
tt3152592,7,2024-01-30,Scoob!,https://www.imdb.com/title/tt3152592/,movie,5.6,93,2020,"Animation, Adventure, Comedy, Family, Fantasy, Mystery, Sci-Fi",29663,2020-05-15,Tony Cervone
tt0315327,9,2021-10-29,Bruce Almighty,https://www.imdb.com/title/tt0315327/,movie,6.8,101,2003,"Comedy, Fantasy",429019,2003-05-14,Tom Shadyac
tt3159812,7,2023-09-01,Monster High: 13 Wishes,https://www.imdb.com/title/tt3159812/,tvMovie,6.9,73,2013,Animation,1270,2013-10-08,"Andrew Duncan, Audu Paden, Steve Sacks"
tt0316654,9,2021-12-25,Spider-Man 2,https://www.imdb.com/title/tt0316654/,movie,7.5,127,2004,"Action, Adventure, Sci-Fi",699422,2004-06-25,Sam Raimi
tt0317219,10,2020-03-26,Cars,https://www.imdb.com/title/tt0317219/,movie,7.2,117,2006,"Animation, Adventure, Comedy, Family, Sport",461738,2006-03-14,"John Lasseter, Joe Ranft"
tt3174376,9,2021-10-09,Before I Wake,https://www.imdb.com/title/tt3174376/,movie,6.2,97,2016,"Drama, Fantasy, Horror, Thriller",51286,2016-04-07,Mike Flanagan
tt0317705,10,2021-07-06,The Incredibles,https://www.imdb.com/title/tt0317705/,movie,8.0,115,2004,"Animation, Action, Adventure, Family",797734,2004-10-27,Brad Bird
tt3183660,9,2023-03-23,Fantastic Beasts and Where to Find Them,https://www.imdb.com/title/tt3183660/,movie,7.2,132,2016,"Adventure, Family, Fantasy",503377,2016-11-08,David Yates
tt0319262,7,2023-03-07,The Day After Tomorrow,https://www.imdb.com/title/tt0319262/,movie,6.5,124,2004,"Action, Adventure, Sci-Fi, Thriller",472156,2004-05-17,Roland Emmerich
tt0319343,8,2021-10-17,Elf,https://www.imdb.com/title/tt0319343/,movie,7.1,97,2003,"Adventure, Comedy, Family, Fantasy, Romance",309063,2003-10-09,Jon Favreau
tt3201640,8,2023-06-11,Extinction,https://www.imdb.com/title/tt3201640/,movie,5.8,95,2018,"Action, Drama, Sci-Fi, Thriller",56985,2018-07-27,Ben Young
tt3203616,8,2021-09-27,The Cobbler,https://www.imdb.com/title/tt3203616/,movie,5.8,99,2014,"Comedy, Drama, Fantasy",59918,2014-09-11,Tom McCarthy
tt0322259,9,2021-08-12,2 Fast 2 Furious,https://www.imdb.com/title/tt0322259/,movie,5.9,107,2003,"Action, Crime, Thriller",294663,2003-06-03,John Singleton
tt0322802,8,2023-07-11,Jackass: The Movie,https://www.imdb.com/title/tt0322802/,movie,6.6,85,2002,"Documentary, Action, Comedy",101565,2002-10-21,Jeff Tremaine
tt3228774,9,2021-11-17,Cruella,https://www.imdb.com/title/tt3228774/,movie,7.3,134,2021,"Adventure, Comedy, Crime, Drama",261262,2021-05-18,Craig Gillespie
tt3230454,10,2020-02-12,The Last Man on Earth,https://www.imdb.com/title/tt3230454/,tvSeries,7.4,22,2015,"Action, Comedy, Drama, Romance, Sci-Fi",63175,2015-03-01,
tt3235888,9,2021-06-14,It Follows,https://www.imdb.com/title/tt3235888/,movie,6.8,100,2014,"Horror, Mystery, Thriller",265510,2014-05-17,David Robert Mitchell
tt0325980,9,2023-07-10,Pirates of the Caribbean: The Curse of the Black Pearl,https://www.imdb.com/title/tt0325980/,movie,8.1,143,2003,"Action, Adventure, Fantasy",1196432,2003-06-28,Gore Verbinski
tt0327084,9,2020-09-29,Over the Hedge,https://www.imdb.com/title/tt0327084/,movie,6.7,83,2006,"Animation, Adventure, Comedy, Family",187847,2006-04-22,"Tim Johnson, Karey Kirkpatrick"
tt3272288,6,2023-03-23,Lilla spöket Laban,https://www.imdb.com/title/tt3272288/,tvSeries,7.1,7,2006,"Animation, Family",41,2006-11-17,
tt0327437,7,2022-12-27,Around the World in 80 Days,https://www.imdb.com/title/tt0327437/,movie,5.9,120,2004,"Action, Adventure, Comedy, Family, Western",94234,2004-06-13,Frank Coraci
tt0327597,10,2022-06-12,Coraline,https://www.imdb.com/title/tt0327597/,movie,7.7,100,2009,"Animation, Drama, Family, Fantasy",259838,2009-02-05,Henry Selick
tt0328538,8,2023-10-07,Thirteen,https://www.imdb.com/title/tt0328538/,movie,6.8,100,2003,Drama,96642,2003-01-17,Catherine Hardwicke
tt3289956,8,2023-05-30,The Autopsy of Jane Doe,https://www.imdb.com/title/tt3289956/,movie,6.8,86,2016,"Horror, Mystery, Thriller",136110,2016-09-09,André Øvredal
tt3300542,8,2023-01-09,London Has Fallen,https://www.imdb.com/title/tt3300542/,movie,5.9,99,2016,"Action, Thriller",168157,2016-02-25,Babak Najafi
tt0330373,9,2021-11-15,Harry Potter and the Goblet of Fire,https://www.imdb.com/title/tt0330373/,movie,7.7,157,2005,"Adventure, Family, Fantasy, Mystery",674047,2005-11-06,Mike Newell
tt3315342,9,2023-12-05,Logan,https://www.imdb.com/title/tt3315342/,movie,8.1,137,2017,"Action, Drama, Sci-Fi, Thriller",819686,2017-02-17,James Mangold
tt3317234,8,2023-03-19,"Game Over, Man!",https://www.imdb.com/title/tt3317234/,movie,5.4,101,2018,"Action, Comedy",32955,2018-03-21,Kyle Newacheck
tt0332379,7,2022-12-28,School of Rock,https://www.imdb.com/title/tt0332379/,movie,7.2,109,2003,"Comedy, Music",326846,2003-09-09,Richard Linklater
